{"type": "object", "additionalProperties": false, "properties": {"colors": {"type": "object", "additionalProperties": {"$ref": "#/$defs/colorOrReference"}}, "metrics": {"type": "object", "additionalProperties": {"$ref": "#/$defs/numberOrReference"}}, "durations": {"type": "object", "additionalProperties": {"oneOf": [{"type": "integer", "minimum": 0.0, "maximum": 10000.0}, {"$ref": "#/$defs/reference"}]}}, "fonts": {"type": "object", "additionalProperties": {"oneOf": [{"$ref": "#/$defs/font"}, {"$ref": "#/$defs/reference"}]}}, "gradients": {"type": "object", "additionalProperties": {"oneOf": [{"$ref": "#/$defs/gradient"}, {"$ref": "#/$defs/reference"}]}}, "strings": {"type": "object", "additionalProperties": {"oneOf": [{"type": "string", "minLength": 0, "maxLength": 256}, {"$ref": "#/$defs/reference"}]}}}, "$schema": "https://json-schema.org/draft/2020-12/schema", "$id": "urn:uuid:c864e7d5-12f1-4c4e-90d9-efdcc26a3016", "x-generatedBy": "Moonwake SkinSchemaRegistry", "x-skinApi": 1, "title": "Moonwake Skin API 1 Tokens", "$defs": {"reference": {"type": "object", "additionalProperties": false, "required": ["$ref"], "properties": {"$ref": {"type": "string", "minLength": 1, "maxLength": 256, "pattern": "^(colors|metrics|durations|fonts|gradients|strings)\\.[A-Za-z0-9_.-]+$"}}}, "color": {"type": "string", "minLength": 0, "pattern": "^#[0-9A-Fa-f]{6}([0-9A-Fa-f]{2})?$"}, "colorOrReference": {"oneOf": [{"$ref": "#/$defs/color"}, {"$ref": "#/$defs/reference"}]}, "numberOrReference": {"oneOf": [{"type": "number"}, {"$ref": "#/$defs/reference"}]}, "path": {"type": "string", "minLength": 1, "maxLength": 512, "pattern": "^assets/(?!.*//)(?!.*(?:^|/)\\.{1,2}(?:/|$))(?!.*\\\\)[^\\u0000]+$"}, "font": {"type": "object", "additionalProperties": false, "required": ["families", "weight"], "properties": {"source": {"$ref": "#/$defs/path"}, "families": {"type": "array", "minItems": 1, "maxItems": 8, "items": {"type": "string", "minLength": 1, "maxLength": 128}}, "weight": {"type": "integer", "minimum": 100.0, "maximum": 900.0, "multipleOf": 100}, "italic": {"type": "boolean", "default": false}, "tracking": {"type": "number", "minimum": -10.0, "maximum": 50.0, "default": 0}}}, "gradientStop": {"type": "object", "additionalProperties": false, "required": ["position", "color"], "properties": {"position": {"type": "number", "minimum": 0.0, "maximum": 1.0}, "color": {"$ref": "#/$defs/colorOrReference"}}}, "gradient": {"type": "object", "additionalProperties": false, "required": ["type", "stops"], "properties": {"type": {"enum": ["linear", "radial"]}, "angle": {"type": "number", "minimum": -3600.0, "maximum": 3600.0}, "centerX": {"type": "number", "minimum": 0.0, "maximum": 1.0}, "centerY": {"type": "number", "minimum": 0.0, "maximum": 1.0}, "radius": {"type": "number", "exclusiveMinimum": 0, "maximum": 2}, "stops": {"type": "array", "minItems": 2, "maxItems": 16, "items": {"$ref": "#/$defs/gradientStop"}}}, "allOf": [{"if": {"properties": {"type": {"const": "linear"}}}, "then": {"required": ["angle"]}}, {"if": {"properties": {"type": {"const": "radial"}}}, "then": {"required": ["centerX", "centerY", "radius"]}}]}}}
