{
  "colors": {
    "example.surface": "#F2EEE7",
    "example.control": "#DDD5C9",
    "example.controlActive": "#C87548",
    "example.text": "#272824",
    "example.focus": "#8D4D2C",
    "example.track": "#BEB7AC",
    "example.studioSurface": "#DEE6E4"
  },
  "metrics": {
    "example.surfaceRadius": 12,
    "example.controlRadius": 8,
    "lyricsText": 26,
    "lyricsCurrentText": 34,
    "lyricsImmersiveText": 30,
    "lyricsImmersiveCurrentText": 40,
    "lyricsMiniText": 17,
    "lyricsLineGap": 28,
    "lyricsPadding": 12
  },
  "durations": {
    "example.fast": 100,
    "lyricsFollow": 260
  },
  "fonts": {
    "example.body": {
      "families": [
        "Avenir Next",
        "sans-serif"
      ],
      "weight": 600
    }
  },
  "gradients": {
    "example.knob": {
      "type": "linear",
      "angle": 135,
      "stops": [
        {
          "position": 0,
          "color": "#F8F4EC"
        },
        {
          "position": 1,
          "color": "#A9A297"
        }
      ]
    }
  }
}
