{
  "colors": {
    "studio.background": "#101820FF",
    "studio.surface": "#1B2731FF",
    "studio.control": "#2A3A46FF",
    "studio.active": "#9CCBD8FF",
    "studio.onActive": "#12222CFF",
    "studio.text": "#EAF1F5FF",
    "studio.muted": "#A0B2BDFF",
    "studio.border": "#344650FF",
    "studio.focus": "#ADD5DFFF",
    "listening.background": "#EDF1F2FF",
    "listening.surface": "#FFFFFFFF",
    "listening.control": "#DEE6E8FF",
    "listening.active": "#315766FF",
    "listening.onActive": "#FFFFFFFF",
    "listening.text": "#243B48FF",
    "listening.muted": "#586D79FF",
    "listening.border": "#D3DDE1FF",
    "listening.focus": "#315766FF",
    "listening.track": "#CAD6DCFF",
    "studio.track": "#3B4D57FF"
  },
  "metrics": {
    "workspaceRadius": 18,
    "controlRadius": 10,
    "studioSurfaceRadius": 10,
    "studioControlRadius": 6,
    "textBody": 19,
    "textControl": 18,
    "textSecondary": 17,
    "textCaption": 16,
    "textSection": 22,
    "textPageTitle": 30,
    "textStudioTitle": 28,
    "textListeningTitle": 28,
    "textMeterValue": 42,
    "textBrand": 32,
    "lyricsText": 26,
    "lyricsCurrentText": 34,
    "lyricsImmersiveText": 30,
    "lyricsImmersiveCurrentText": 40,
    "lyricsMiniText": 17,
    "lyricsLineGap": 28,
    "lyricsPadding": 12
  },
  "durations": {
    "workspaceFast": 110,
    "lyricsFollow": 260
  },
  "fonts": {
    "workspaceBody": {
      "families": [
        "Avenir Next",
        "Helvetica Neue",
        "sans-serif"
      ],
      "weight": 400
    },
    "workspaceMedium": {
      "families": [
        "Avenir Next",
        "Helvetica Neue",
        "sans-serif"
      ],
      "weight": 500
    },
    "workspaceTitle": {
      "families": [
        "Avenir Next",
        "Helvetica Neue",
        "sans-serif"
      ],
      "weight": 600
    },
    "workspaceData": {
      "families": [
        "SF Mono",
        "Menlo",
        "monospace"
      ],
      "weight": 500,
      "tracking": 0
    }
  },
  "strings": {
    "defaultWorkspace": "listening"
  }
}
