{
  "colors": {
    "example.surface": "#F2EEE7",
    "example.control": "#DDD5C9",
    "example.controlActive": "#C87548",
    "example.text": "#272824",
    "example.focus": "#8D4D2C",
    "example.track": "#BEB7AC"
  },
  "metrics": {
    "example.surfaceRadius": 12,
    "example.controlRadius": 8
  },
  "durations": {
    "example.fast": 100
  },
  "fonts": {
    "example.body": {
      "families": ["Avenir Next", "sans-serif"],
      "weight": 600
    }
  },
  "gradients": {
    "example.knob": {
      "type": "linear",
      "angle": 135,
      "stops": [
        {
          "position": 0,
          "color": "#F8F4EC"
        },
        {
          "position": 1,
          "color": "#A9A297"
        }
      ]
    }
  }
}
