{
  "colors": {
    "background": "#17191DFF",
    "surface": "#22252BFF",
    "surfaceRaised": "#2B2F37FF",
    "control": "#343943FF",
    "controlActive": "#D69762FF",
    "text": "#F7F3EDFF",
    "textMuted": "#B9BDC6FF",
    "border": "#464C57FF",
    "focus": "#F4B37CFF",
    "track": "#565C66FF",
    "transparent": "#00000000"
  },
  "metrics": {
    "radius": 8,
    "panelRadius": 12,
    "stroke": 1,
    "routingRowHeight": 44,
    "routingHeaderHeight": 32,
    "focusOverlayOpacity": 0.16,
    "focusSurfaceOpacity": 0.06,
    "lyricsText": 26,
    "lyricsCurrentText": 34,
    "lyricsImmersiveText": 30,
    "lyricsImmersiveCurrentText": 40,
    "lyricsMiniText": 17,
    "lyricsLineGap": 28,
    "lyricsPadding": 12
  },
  "durations": {
    "fast": 100,
    "lyricsFollow": 260
  },
  "fonts": {
    "body": {
      "families": [
        "Helvetica Neue",
        "Arial",
        "sans-serif"
      ],
      "weight": 400
    },
    "medium": {
      "families": [
        "Helvetica Neue",
        "Arial",
        "sans-serif"
      ],
      "weight": 600
    },
    "title": {
      "families": [
        "Avenir Next",
        "Helvetica Neue",
        "sans-serif"
      ],
      "weight": 600
    },
    "data": {
      "families": [
        "SF Mono",
        "Menlo",
        "monospace"
      ],
      "weight": 500,
      "tracking": 0.015
    }
  },
  "strings": {
    "appearance": "dark"
  }
}
